[
  {
    "name": "Temperature Sensor 01",
    "dev_eui": "0123456789ABCDEF",
    "description": "Outdoor temperature sensor for parking lot",
    "**application_id": "AUTO-FILL",
    "**device_profile_id": "AUTO-FILL",
    "application_name": "environmental-monitoring",
    "device_profile_name": "class-a-sensor",
    "skipFCntCheck": false,
    "is_disabled": false,
    "variables": {
      "location": "parking-lot-north",
      "sensor_type": "temperature"
    },
    "tags": {
      "environment": "production",
      "deployment": "phase-1"
    },
    "_deviceKeys": {
      "**dev_eui": "AUTO-PARENT",
      "nwk_key": "0123456789ABCDEF0123456789ABCDEF"
    }
  },
  {
    "name": "Motion Sensor 01",
    "dev_eui": "FEDCBA9876543210",
    "description": "PIR motion sensor for building entrance",
    "**application_id": "AUTO-FILL",
    "**device_profile_id": "AUTO-FILL",
    "application_name": "security-monitoring",
    "device_profile_name": "class-a-sensor",
    "skipFCntCheck": false,
    "is_disabled": false,
    "variables": {
      "location": "building-entrance",
      "sensor_type": "motion"
    },
    "tags": {
      "environment": "production",
      "deployment": "phase-1"
    },
    "_deviceKeys": {
      "**dev_eui": "AUTO-PARENT",
      "nwk_key": "FEDCBA9876543210FEDCBA9876543210"
    }
  },
  {
    "name": "Humidity Sensor 01",
    "dev_eui": "1122334455667788",
    "description": "Indoor humidity sensor for office space",
    "**application_id": "AUTO-FILL",
    "**device_profile_id": "AUTO-FILL",
    "application_name": "environmental-monitoring",
    "device_profile_name": "class-a-sensor",
    "skipFCntCheck": false,
    "is_disabled": false,
    "variables": {
      "location": "office-floor-3",
      "sensor_type": "humidity"
    },
    "tags": {
      "environment": "production",
      "deployment": "phase-2"
    },
    "_deviceKeys": {
      "**dev_eui": "AUTO-PARENT",
      "nwk_key": "11223344556677881122334455667788"
    }
  }
]